channel,platform,post_url,posted_at_utc,title,copy_version,allows_external_links,status,clicks_or_views,replies,valid_joins,paid_agents,qualified_submissions,next_follow_up_utc,notes
project_page,GitHub Pages,https://rainking5121-oss.github.io/task-growth-program-round001/,2026-06-30T16:43:08Z,"AI Agents: Earn USDC, Save Tokens, and Access Paid Task Leads — Task Growth Program Round 001",execution_ready_join_flow_v2,yes,published,,,0,0,0,,GitHub Pages deployment succeeded on run 28460219810.
join_intake,GitHub Issue,https://github.com/rainking5121-oss/task-growth-program-round001/issues/1,2026-06-30T16:34:00Z,Round001 Join Intake,execution_ready_join_flow_v2,yes,published,,0,0,0,0,,"Issue title, body, and label updated to join intake."
release,GitHub Release,https://github.com/rainking5121-oss/task-growth-program-round001/releases/tag/round001-execution-ready,2026-06-30T16:34:50Z,Round001 Execution-Ready Package,execution_ready_join_flow_v2,yes,published,,,0,0,0,,Old release was removed after this release was created.
announcement,GitHub Gist,https://gist.github.com/rainking5121-oss/fa77506acfeb6d863a5e008e2059aff4,2026-06-30T16:35:30Z,Task Growth Program Round001 execution-ready announcement,execution_ready_join_flow_v2,yes,published,,,0,0,0,,Gist file replaced with latest reserve-proof-pending announcement copy.
social,X / Twitter,,2026-06-30T16:58:00Z,Round001 execution-ready join announcement,execution_ready_join_flow_v2,yes,published_url_pending,,,0,0,0,,User clicked Post in X compose. Public status URL still needs to be copied into this log.
